{
  "version": 1,
  "fallback": "en",
  "ui": {
    "fallbackLabel": { "zh": "选择模型", "en": "Select model" },
    "triggerLabel": { "zh": "选择模型，当前 {model}", "en": "Select model, currently {model}" },
    "loading": { "zh": "正在加载模型…", "en": "Loading models…" },
    "empty": { "zh": "没有可用的模型。", "en": "No models available." },
    "effortLabel": { "zh": "推理等级", "en": "Reasoning effort" },
    "effortFaster": { "zh": "更快", "en": "Faster" },
    "effortSmarter": { "zh": "更强", "en": "Smarter" },
    "moreLabel": { "zh": "更多模型", "en": "More models" },
    "archiveActive": { "zh": "进行中", "en": "Active" },
    "archiveArchived": { "zh": "已归档", "en": "Archived" },
    "archiveDelete": { "zh": "删除会话", "en": "Delete conversation" },
    "archiveRestore": { "zh": "取消归档", "en": "Unarchive conversation" },
    "archiveEmpty": { "zh": "没有已归档的会话", "en": "No archived conversations" },
    "archiveLoading": { "zh": "正在加载…", "en": "Loading…" },
    "archiveJustNow": { "zh": "刚刚", "en": "Just now" },
    "archiveMinutes": { "zh": "{count} 分钟", "en": "{count} min" },
    "archiveHours": { "zh": "{count} 小时", "en": "{count} h" },
    "archiveDays": { "zh": "{count} 天", "en": "{count} d" },
    "archiveDeleteFailed": { "zh": "删除失败：{detail}", "en": "Delete failed: {detail}" },
    "archiveDeleteOpen": { "zh": "会话仍被本应用占用，重启后再删除", "en": "The conversation is still held open by this app; restart it, then delete again" },
    "searchPlaceholder": { "zh": "搜索", "en": "Search" },
    "searchClose": { "zh": "关闭", "en": "Close" },
    "searchFilterHint": { "zh": "切换分类", "en": "Filters" },
    "searchOpenHint": { "zh": "打开", "en": "Open" },
    "searchFilterAll": { "zh": "全部", "en": "All" },
    "searchFilterSessions": { "zh": "会话", "en": "Sessions" },
    "searchFilterProjects": { "zh": "项目", "en": "Projects" },
    "searchFilterPlugins": { "zh": "插件", "en": "Plugins" },
    "searchFilterSkills": { "zh": "Skill", "en": "Skills" },
    "searchFilterShortcuts": { "zh": "快捷键", "en": "Shortcuts" },
    "searchRecents": { "zh": "最近", "en": "Recents" },
    "searchActions": { "zh": "操作", "en": "Actions" },
    "searchSessions": { "zh": "会话", "en": "Sessions" },
    "searchProjects": { "zh": "项目", "en": "Projects" },
    "searchPlugins": { "zh": "插件", "en": "Plugins" },
    "searchSkills": { "zh": "Skill", "en": "Skills" },
    "searchShortcuts": { "zh": "快捷键", "en": "Shortcuts" },
    "searchActionNewSession": { "zh": "新会话", "en": "New session" },
    "searchActionPlugins": { "zh": "插件", "en": "Plugins" },
    "searchActionSettings": { "zh": "设置", "en": "Settings" },
    "searchActionShortcuts": { "zh": "键盘快捷键", "en": "Keyboard shortcuts" },
    "searchLoading": { "zh": "正在搜索…", "en": "Searching…" },
    "searchEmpty": { "zh": "没有匹配的结果", "en": "No results" },
    "turnStatusTokens": { "zh": "{count} tokens", "en": "{count} tokens" },
    "turnStatusWaiting": { "zh": "等待模型…", "en": "Waiting for the model…" },
    "turnStatusThinking": { "zh": "思考中…", "en": "Thinking…" },
    "turnStatusThought": { "zh": "思考了 {duration}", "en": "Thought for {duration}" },
    "turnStatusWriting": { "zh": "输出中…", "en": "Writing…" },
    "turnStatusToolCall": { "zh": "准备调用工具…", "en": "Preparing a tool call…" },
    "turnStatusTools": { "zh": "运行工具中…", "en": "Running tools…" },
    "homeTabOverview": { "zh": "概览", "en": "Overview" },
    "homeTabModels": { "zh": "模型", "en": "Models" },
    "homeRangeAll": { "zh": "全部", "en": "All" },
    "homeRange30d": { "zh": "30 天", "en": "30d" },
    "homeRange7d": { "zh": "7 天", "en": "7d" },
    "homePeakHour": { "zh": "高峰时段", "en": "Peak hour" },
    "homeHourAm": { "zh": "上午 {hour} 点", "en": "{hour} AM" },
    "homeHourPm": { "zh": "下午 {hour} 点", "en": "{hour} PM" },
    "homeFunBook": { "zh": "你的Token用量相当于{count}本{book}。", "en": "You've used ~{count}× the tokens in {book}." },
    "homeBookAnimalFarm": { "zh": "《动物农场》", "en": "Animal Farm" },
    "homeBookGatsby": { "zh": "《了不起的盖茨比》", "en": "The Great Gatsby" },
    "homeBookPhilosophersStone": { "zh": "《哈利·波特与魔法石》", "en": "Harry Potter and the Philosopher's Stone" },
    "homeBook1984": { "zh": "《一九八四》", "en": "Nineteen Eighty-Four" },
    "homeBookHobbit": { "zh": "《霍比特人》", "en": "The Hobbit" },
    "homeBookPride": { "zh": "《傲慢与偏见》", "en": "Pride and Prejudice" },
    "homeBookMobyDick": { "zh": "《白鲸》", "en": "Moby-Dick" },
    "homeBookLordOfTheRings": { "zh": "《魔戒》", "en": "The Lord of the Rings" },
    "homeBookWarAndPeace": { "zh": "《战争与和平》", "en": "War and Peace" },
    "homeBookHarryPotter": { "zh": "《哈利·波特》全集", "en": "the whole Harry Potter series" },
    "homeBookLostTime": { "zh": "《追忆似水年华》", "en": "In Search of Lost Time" },
    "homeBookTaoTeChing": { "zh": "《道德经》", "en": "Tao Te Ching" },
    "homeBookAlice": { "zh": "《爱丽丝漫游奇境》", "en": "Alice's Adventures in Wonderland" },
    "homeBookChristmasCarol": { "zh": "《圣诞颂歌》", "en": "A Christmas Carol" },
    "homeBookFrankenstein": { "zh": "《弗兰肯斯坦》", "en": "Frankenstein" },
    "homeBookDorianGray": { "zh": "《道林·格雷的画像》", "en": "The Picture of Dorian Gray" },
    "homeBookToLive": { "zh": "《活着》", "en": "To Live" },
    "homeBookSherlockHolmes": { "zh": "《福尔摩斯冒险史》", "en": "The Adventures of Sherlock Holmes" },
    "homeBookHuckleberryFinn": { "zh": "《哈克贝利·费恩历险记》", "en": "Adventures of Huckleberry Finn" },
    "homeBookThreeBody": { "zh": "《三体》", "en": "The Three-Body Problem" },
    "homeBookDracula": { "zh": "《德古拉》", "en": "Dracula" },
    "homeBookJaneEyre": { "zh": "《简·爱》", "en": "Jane Eyre" },
    "homeBookDarkForest": { "zh": "《三体Ⅱ·黑暗森林》", "en": "The Dark Forest" },
    "homeBookDeathsEnd": { "zh": "《三体Ⅲ·死神永生》", "en": "Death's End" },
    "homeBookThreeKingdoms": { "zh": "《三国演义》", "en": "Romance of the Three Kingdoms" },
    "homeBookJourneyWest": { "zh": "《西游记》", "en": "Journey to the West" },
    "homeBookRedChamber": { "zh": "《红楼梦》", "en": "Dream of the Red Chamber" },
    "homeBookWaterMargin": { "zh": "《水浒传》", "en": "Water Margin" },
    "homeBookOrdinaryWorld": { "zh": "《平凡的世界》", "en": "Ordinary World" },
    "homeBookYellowWallpaper": { "zh": "《黄色壁纸》", "en": "The Yellow Wallpaper" },
    "homeBookMetamorphosis": { "zh": "《变形记》", "en": "Metamorphosis" },
    "homeBookJekyllAndHyde": { "zh": "《化身博士》", "en": "The Strange Case of Dr Jekyll and Mr Hyde" },
    "homeBookCallOfTheWild": { "zh": "《野性的呼唤》", "en": "The Call of the Wild" },
    "homeBookTimeMachine": { "zh": "《时间机器》", "en": "The Time Machine" },
    "homeBookWizardOfOz": { "zh": "《绿野仙踪》", "en": "The Wonderful Wizard of Oz" },
    "homeBookHeartOfDarkness": { "zh": "《黑暗之心》", "en": "Heart of Darkness" },
    "homeBookFaust": { "zh": "《浮士德》", "en": "Faust" },
    "homeBookTurnOfTheScrew": { "zh": "《螺丝在拧紧》", "en": "The Turn of the Screw" },
    "homeBookAesopsFables": { "zh": "《伊索寓言》", "en": "Aesop's Fables" },
    "homeBookPeterPan": { "zh": "《彼得·潘》", "en": "Peter Pan" },
    "homeBookPrince": { "zh": "《君主论》", "en": "The Prince" },
    "homeBookInvisibleMan": { "zh": "《隐形人》", "en": "The Invisible Man" },
    "homeBookAndersensFairyTales": { "zh": "《安徒生童话》", "en": "Andersen's Fairy Tales" },
    "homeBookWarOfTheWorlds": { "zh": "《世界大战》", "en": "The War of the Worlds" },
    "homeBookBeyondGoodAndEvil": { "zh": "《善恶的彼岸》", "en": "Beyond Good and Evil" },
    "homeBookWhiteFang": { "zh": "《白牙》", "en": "White Fang" },
    "homeBookMeditations": { "zh": "《沉思录》", "en": "Meditations" },
    "homeBookGrimmsFairyTales": { "zh": "《格林童话》", "en": "Grimms' Fairy Tales" },
    "homeBookGulliversTravels": { "zh": "《格列佛游记》", "en": "Gulliver's Travels" },
    "homeBookWalden": { "zh": "《瓦尔登湖》", "en": "Walden" },
    "homeBookRobinsonCrusoe": { "zh": "《鲁滨逊漂流记》", "en": "Robinson Crusoe" },
    "homeBookDivineComedy": { "zh": "《神曲》", "en": "The Divine Comedy" },
    "homeBookMadameBovary": { "zh": "《包法利夫人》", "en": "Madame Bovary" },
    "homeBookZarathustra": { "zh": "《查拉图斯特拉如是说》", "en": "Thus Spoke Zarathustra" },
    "homeBookOdyssey": { "zh": "《奥德赛》", "en": "The Odyssey" },
    "homeBookTaleOfTwoCities": { "zh": "《双城记》", "en": "A Tale of Two Cities" },
    "homeBookGreatExpectations": { "zh": "《远大前程》", "en": "Great Expectations" },
    "homeBookRepublic": { "zh": "《理想国》", "en": "The Republic" },
    "homeBookCrimeAndPunishment": { "zh": "《罪与罚》", "en": "Crime and Punishment" },
    "homeBookLeviathan": { "zh": "《利维坦》", "en": "Leviathan" },
    "homeBookAnnaKarenina": { "zh": "《安娜·卡列尼娜》", "en": "Anna Karenina" },
    "homeBookBrothersKaramazov": { "zh": "《卡拉马佐夫兄弟》", "en": "The Brothers Karamazov" },
    "homeBookDonQuixote": { "zh": "《堂吉诃德》", "en": "Don Quixote" },
    "homeBookCountOfMonteCristo": { "zh": "《基督山伯爵》", "en": "The Count of Monte Cristo" },
    "homeBookLesMiserables": { "zh": "《悲惨世界》", "en": "Les Misérables" },
    "homeModelSessions": { "zh": "{count} 个会话", "en": "{count} sessions" },
    "homeModelsEmpty": { "zh": "暂无模型数据", "en": "No model data yet" },
    "homeModelsMore": { "zh": "再显示 {count} 个", "en": "Show {count} more" },
    "homeModelsLess": { "zh": "收起", "en": "Show less" },
    "homeTokens": { "zh": "Token 总量", "en": "Total tokens" },
    "homeCalls": { "zh": "消息数", "en": "Messages" },
    "homeSessions": { "zh": "会话数", "en": "Sessions" },
    "homeActiveDays": { "zh": "活跃天数", "en": "Active days" },
    "homeTopModel": { "zh": "最常用模型", "en": "Favorite model" },
    "homeHeatTipTokens": { "zh": "{date} — {tokens} Token", "en": "{date} — {tokens} tokens" },
    "contextTotalTime": { "zh": "总用时", "en": "Total time" }
  },
  "settings": {
    "title": { "zh": "Claude Style", "en": "Claude Style" },
    "brandTitle": { "zh": "品牌标识", "en": "Brand mark" },
    "brandDesc": {
      "zh": "插件提供的品牌标识和配色色系风格。",
      "en": "The brand mark in the sidebar and on the home page, and its colour family: warm for Claude, blue for DeepSeek. While Colours is set to Follow the host, only the mark changes."
    },
    "collapseTitle": { "zh": "折叠侧栏设置区", "en": "Collapse the sidebar settings area" },
    "collapseDesc": {
      "zh": "将侧栏底部的设置入口收进账户弹层。",